<?xml version="1.0" encoding="UTF-8"?>

<medicines  xmlns:xs="http://www.w3.org/2001/XMLSchema-instance"
            xs:noNamespaceSchemaLocation="medicine.xsd">

    <medicine>
        <name>asd</name>
        <pharm>pharm1</pharm>
        <group>antibiotic</group>
        <analogs>
            <analog>A</analog>
            <analog>B</analog>
        </analogs>
        <versions>
            <version>
                <consistention>tablet</consistention>
                <manufacturer>
                    <manufaturer_name>first</manufaturer_name>
                    <certificate>
                        <number>12345</number>
                        <date_start>2020-02-10</date_start>
                        <date_end>2021-02-10</date_end>
                        <registration>registrator1</registration>
                    </certificate>
                    <package>
                        <type>box</type>
                        <amount>13</amount>
                        <price>6.5</price>
                    </package>
                    <dosage>
                        <dose>0.5</dose>
                        <schedule>3</schedule>
                    </dosage>
                </manufacturer>
            </version>
            <version>
                <consistention>capsule</consistention>
                <manufacturer>
                    <manufaturer_name>gghhh</manufaturer_name>
                    <certificate>
                        <number>123</number>
                        <date_start>2020-10-02</date_start>
                        <date_end>2020-10-03</date_end>
                        <registration>registrator2</registration>
                    </certificate>
                    <package>
                        <type>tube</type>
                        <amount>123</amount>
                        <price>34.9</price>
                    </package>
                    <dosage>
                        <dose>1.0</dose>
                        <schedule>5</schedule>
                    </dosage>
                </manufacturer>
            </version>
            <version>
                <consistention>powder</consistention>
                <manufacturer>
                    <manufaturer_name>sdfgh</manufaturer_name>
                    <certificate>
                        <number>980</number>
                        <date_start>2021-01-01</date_start>
                        <date_end>2025-01-01</date_end>
                        <registration>registrator2</registration>
                    </certificate>
                    <package>
                        <type>sticker</type>
                        <amount>4</amount>
                        <price>56.0</price>
                    </package>
                    <dosage>
                        <dose>0.5</dose>
                        <schedule>3</schedule>
                    </dosage>
                </manufacturer>
            </version>

        </versions>
    </medicine>

</medicines>
